{
  "contract": "anibench.level1-role-aware-target-authority.v3",
  "enrollment_authority": {
    "forbidden_derivations": [
      "inherit_v2_global_enrollment",
      "sum_family_numbers_without_disjointness_or_covariance_authority",
      "max_family_number_as_implicit_complete_reuse",
      "derive_sample_size_from_coordinate_count_or_modality_count",
      "emit_number_when_any_family_operating_characteristic_is_unknown"
    ],
    "global_enrollment": {
      "blocker_code": "WITHHELD_PENDING_ALL_FAMILY_OPERATING_CHARACTERISTICS_AND_SOURCE_BOUND_JOINT_CONTEXT_SUPPORT",
      "fact_type": "unknown",
      "state": "unresolved",
      "unit": "participants",
      "value": null
    },
    "release_condition": {
      "aggregation_rule_resolved": false,
      "all_family_specific_enrollment_derivations_resolved": false,
      "all_family_specific_operating_characteristic_targets_resolved": false,
      "cross_family_reuse_and_covariance_resolved": false,
      "source_bound_joint_context_support_resolved": false
    }
  },
  "estimation_role_authority": {
    "direct_event_outcome_coordinate_ids": [
      "S02",
      "S03",
      "S04",
      "S05",
      "S06",
      "S07",
      "S08",
      "S10",
      "S11",
      "S12",
      "S13",
      "S14",
      "S15",
      "S16",
      "F01",
      "F02",
      "F03",
      "F04",
      "F05",
      "F06",
      "F07",
      "F08"
    ],
    "exposure_context_coordinate_ids": [
      "S09"
    ],
    "forbidden_role_coercions": [
      "D_P_H_or_T_coordinate_to_direct_event_outcome",
      "D_P_H_or_T_coordinate_to_raw_moderator",
      "D_P_H_or_T_coordinate_to_raw_context_stratum",
      "S01_to_mutable_outcome",
      "S09_to_transport_estimand",
      "assay_feature_or_modality_to_coordinate_without_observation_operator"
    ],
    "partition_rule": "every_frozen_coordinate_has_exactly_one_estimation_role_and_roles_do_not_overlap",
    "raw_modifier_coordinate_ids": [
      "S01"
    ],
    "relational_estimand_coordinate_ids": [
      "D01",
      "D02",
      "D03",
      "D04",
      "D05",
      "D06",
      "D07",
      "D08",
      "D09",
      "D10",
      "D11",
      "D12",
      "P01",
      "P02",
      "P03",
      "P04",
      "P05",
      "P06",
      "P07",
      "P08",
      "P09",
      "P10",
      "P11",
      "P12",
      "H01",
      "H02",
      "H03",
      "H04",
      "H05",
      "H06",
      "H07",
      "H08",
      "T01",
      "T02",
      "T03",
      "T04",
      "T05",
      "T06",
      "T07",
      "T08"
    ],
    "roles": [
      {
        "coordinate_ids": [
          "S02",
          "S03",
          "S04",
          "S05",
          "S06",
          "S07",
          "S08",
          "S10",
          "S11",
          "S12",
          "S13",
          "S14",
          "S15",
          "S16",
          "F01",
          "F02",
          "F03",
          "F04",
          "F05",
          "F06",
          "F07",
          "F08"
        ],
        "is_direct_event_outcome_role": true,
        "is_relational_estimand_role": false,
        "role_id": "direct_mutable_outcome_basis",
        "semantics": "Latent mutable state or function direction permitted as an event-level outcome after a source-bound observation operator, scale, reliability model, and event linkage are verified. Coordinate presence alone is not measurement evidence."
      },
      {
        "coordinate_ids": [
          "S01"
        ],
        "is_direct_event_outcome_role": false,
        "is_relational_estimand_role": false,
        "role_id": "baseline_modifier",
        "semantics": "Stable pre-assignment modifier direction. It may enter registered moderation models but is not a mutable event outcome or an effect estimand."
      },
      {
        "coordinate_ids": [
          "S09"
        ],
        "is_direct_event_outcome_role": false,
        "is_relational_estimand_role": false,
        "role_id": "exposure_context",
        "semantics": "Time-indexed exposure or context direction. It may define context or adjustment variables but is not a transport estimand and is not a mutable outcome target."
      },
      {
        "coordinate_ids": [
          "D01",
          "D02",
          "D03",
          "D04",
          "D05",
          "D06",
          "D07",
          "D08",
          "D09",
          "D10",
          "D11",
          "D12"
        ],
        "is_direct_event_outcome_role": false,
        "is_relational_estimand_role": true,
        "role_id": "longitudinal_state_space_estimand",
        "semantics": "A relational target derived from repeated direct outcomes through an explicit state-transition, observation, process-noise, and time-index model."
      },
      {
        "coordinate_ids": [
          "P01",
          "P02",
          "P03",
          "P04",
          "P05",
          "P06",
          "P07",
          "P08",
          "P09",
          "P10",
          "P11",
          "P12"
        ],
        "is_direct_event_outcome_role": false,
        "is_relational_estimand_role": true,
        "role_id": "causal_response_estimand",
        "semantics": "A counterfactual or randomized response relation over direct outcomes and registered intervention operators; never a direct assay or event outcome."
      },
      {
        "coordinate_ids": [
          "H01",
          "H02",
          "H03",
          "H04",
          "H05",
          "H06",
          "H07",
          "H08"
        ],
        "is_direct_event_outcome_role": false,
        "is_relational_estimand_role": true,
        "role_id": "heterogeneity_operating_characteristic",
        "semantics": "An operating-characteristic target for variation, calibration, or decision-rule performance across persons or contexts; never a raw moderator coordinate."
      },
      {
        "coordinate_ids": [
          "T01",
          "T02",
          "T03",
          "T04",
          "T05",
          "T06",
          "T07",
          "T08"
        ],
        "is_direct_event_outcome_role": false,
        "is_relational_estimand_role": true,
        "role_id": "transport_estimand",
        "semantics": "A source-to-target population relation over direct outcomes under a registered joint context support authority; never a raw context covariate or stratum label."
      }
    ]
  },
  "family_operating_characteristic_authority": {
    "families": [
      {
        "family_enrollment_requirement": {
          "blocker_code": "MISSING_INTENSIVE_FAMILY_ENROLLMENT_DERIVATION",
          "fact_type": "unknown",
          "state": "unresolved",
          "unit": "participants_or_participant_events_as_defined_by_future_authority",
          "value": null
        },
        "family_id": "intensive",
        "forbidden_substitutions": [
          "assay_or_modality_menu_size",
          "feature_count_without_observation_operator_and_covariance",
          "relational_estimand_count_as_event_information"
        ],
        "operating_characteristic_target": {
          "blocker_code": "MISSING_INTENSIVE_FAMILY_OPERATING_CHARACTERISTIC_TARGET",
          "fact_type": "unknown",
          "state": "unresolved",
          "value": null
        },
        "required_gate_ids": [
          "direct_outcome_observation_authority",
          "intensive_operating_characteristics"
        ],
        "scientific_question": "How much source-bound information about the direct mutable outcome basis is resolved within a participant-event?",
        "support_coordinate_roles": [
          "baseline_modifier",
          "exposure_context"
        ],
        "target_coordinate_roles": [
          "direct_mutable_outcome_basis"
        ]
      },
      {
        "family_enrollment_requirement": {
          "blocker_code": "MISSING_EXTENSIVE_FAMILY_ENROLLMENT_DERIVATION",
          "fact_type": "unknown",
          "state": "unresolved",
          "unit": "participants_or_participant_events_as_defined_by_future_authority",
          "value": null
        },
        "family_id": "extensive",
        "forbidden_substitutions": [
          "raw_modality_count",
          "raw_feature_count",
          "D_P_H_or_T_coordinates_as_directly_measured_dimensions"
        ],
        "operating_characteristic_target": {
          "blocker_code": "MISSING_EXTENSIVE_FAMILY_OPERATING_CHARACTERISTIC_TARGET",
          "fact_type": "unknown",
          "state": "unresolved",
          "value": null
        },
        "required_gate_ids": [
          "direct_outcome_observation_authority",
          "extensive_operating_characteristics"
        ],
        "scientific_question": "How broadly are role-eligible direct outcome and support directions identified without counting redundant observers as new biology?",
        "support_coordinate_roles": [],
        "target_coordinate_roles": [
          "direct_mutable_outcome_basis",
          "baseline_modifier",
          "exposure_context"
        ]
      },
      {
        "family_enrollment_requirement": {
          "blocker_code": "MISSING_LONGITUDINAL_FAMILY_ENROLLMENT_DERIVATION",
          "fact_type": "unknown",
          "state": "unresolved",
          "unit": "participants_or_participant_events_as_defined_by_future_authority",
          "value": null
        },
        "family_id": "longitudinal",
        "forbidden_substitutions": [
          "visit_count_without_time_process",
          "D_coordinate_as_event_outcome",
          "repeated_measurement_count_without_dependence_model"
        ],
        "operating_characteristic_target": {
          "blocker_code": "MISSING_LONGITUDINAL_FAMILY_OPERATING_CHARACTERISTIC_TARGET",
          "fact_type": "unknown",
          "state": "unresolved",
          "value": null
        },
        "required_gate_ids": [
          "direct_outcome_observation_authority",
          "longitudinal_state_space_operating_characteristics"
        ],